{
  "schema_version": "1.0",
  "agent_version": "0.1.0",
  "platform": "macos",
  "hostname": "Ray Mac",
  "observed_at": "2026-08-05T08:00:00Z",
  "clock_skew_ms": 12,
  "disk_available_bytes": 107374182400,
  "execution_slot": {
    "state": "idle",
    "execution_id": null
  },
  "devices": [
    {
      "client_ref": "74000000-0000-4000-8000-000000000001",
      "serial": "R3CN30ABC7K2A",
      "manufacturer": "UNISOC",
      "model": "ums9620",
      "android_release": "15",
      "api_level": 35,
      "connection_type": "usb",
      "adb_state": "device",
      "battery_percent": 82,
      "temperature_c": 31.5,
      "storage_available_bytes": 42949672960,
      "property_error_code": null
    }
  ]
}
